{
  "configVersion": 2,
  "profileOrder": [
    "LOW",
    "HIGH"
  ],
  "profiles": {
    "LOW": {
      "requests": {
        "cpu": "100m",
        "memory": "256Mi"
      },
      "limits": {
        "cpu": "1",
        "memory": "1Gi"
      }
    },
    "HIGH": {
      "requests": {
        "cpu": "800m",
        "memory": "256Mi"
      },
      "limits": {
        "cpu": "1",
        "memory": "1Gi"
      }
    }
  },
  "triggers": [
    {
      "type": "memory",
      "metricType": "Utilization",
      "metadata": {}
    }
  ],
  "pollingInterval": 15,
  "updatePolicy": {
    "mode": "Off",
    "allowRollingFallback": false
  },
  "behavior": {
    "scaleUp": {
      "stabilizationSeconds": 30
    },
    "scaleDown": {
      "stepIntervalSeconds": 60,
      "memoryHeadroomPercent": 20
    },
    "metrics": {
      "maxAgeSeconds": 60
    }
  },
  "kubernetes": {
    "namespace": "rmq-v23-e2e-native",
    "rmqServiceName": "rmq-probe"
  }
}
